Cityweb Technologies,Sayansi, Dar Es Salaam,Cityweb Technologies is a company registered by The Registrar of Companies Tanzania. We strive to deliver our software and information systems expertise to our vicinity and beyond. Expertise Our exper...,/img/tz/e/_1421262608-53-cityweb-technologies.png
Climate Air Limited Tanzania,9 Kaunda Drive and Zambia Street, Oysterbay, Dar Es Salaam,Climate Air Limited is One of Tanzania’s prestigious Air Conditioning Company, providing thermal comfort and acceptable indoor air quality for Residential, Commercial and Industrial application. We of...,/img/tz/x/_1620735568-57-climate-air-limited-tanzania.jpg
Conveyance Container Tanzania Company Ltd,Julius K. Nyerere Road Block G, Plot No 303 Mchicha Star Africa Freight Forwarding (SAFF) Building , Dar Es Salaam,We make the impossible possible Conveyance Containers Limited is a mid-sized company specializing in acquisition and selling of dry shipping containers as well as refrigerating containers (reefers) of...,/img/tz/l/_1614782526-48-conveyance-container-tanzania-company-ltd.jpg
DAYA PREMJI LTD,Crescent Flat Building, Opp Hayderi Plaza, Upanga/ Ali Hassan Mwinyi Rd, Dar Es Salaam, Tanzania, Dar Es Salaam,Daya Premji Ltd is family run business established in 1976 leading in supply of Industrial hardware, welding consumables and general hardware. We are based in Dar-Es-Salaam with outlets in Moshi and A...,/img/tz/f/_1656061831-19-daya-premji-ltd.jpg
DELMAT GLOBAL LTD,Plot No. 638,Block No. 57,Next to NHC House, Zanaki Street , Dar Es Salaam,Delmat is established company based in Dar es salaam, Tanzania dealing with Multiproducts and multi services ranging from Cleaning Services Solutions, Waste management Solutions and other.,/img/tz/a/_1509466810-51-delmat-global-ltd.jpg
EQUIPLAMA AFRICA,P.O.BOX 16201, Dar Es Salaam,The Company deals with supply of premium industrial machine,Plants,Equipments [Energy,Construction,Printing,Processing,Mining,Transport,Marine,Telecom,Security,Port and Rail] international trade, real...,/img/tz/z/_1435329093-85-equiplama-africa.jpg
ESSENCE CONSULT LIMITED,Plot No.2319/9,1st Floor,NHC Building,Makunganya Street, Dar Es Salaam,Marketing & Sales Including E-Commerce: Marketing plans Marketing audits Market analysis Service development New service launch Advertising plans Advertising audits Pricing analysis Competitor analysi...,/img/tz/s/_1477569160-38-essence-consult-limited.png
FAKHRU AND BROTHERS GEN SUPPLIES,B0X 69080, Dar Es Salaam,FAKHRU AND BROTHERS WE DEAL WITH TERRAZZO AND WALL TILES INSTALLATION AROUND THE COUNTRY,/img/tz/k/_1457271322-25-fakhru-and-brothers-gen-supplies.jpg
FIRST RENTAL CONSTRUCTION EQUIPMENT,MIKOCHENI, Dar Es Salaam,Creating a safe environment for you with our scaffolding materials. Formworks Scaffolding Hire at cheaper price. Dar es salam/Tanzania for more information,/img/tz/n/_1703760103-57-first-rental-construction-equipment.jpg
Fort ICT SOLUTIONS signs branding,P O box 4473, Dar Es Salaam,Deals with branding sign ..... filling stations rebranding and branding, 3d cutter letter....pylon fubrications. Vehicles branding,/img/tz/d/_1593351909-25-fort-ict-solutions-signs-branding.jpg
FURMIGATION AND PETS,UBUNGO, Dar Es Salaam,KAMPUNI YETU INAHUSIKA NA KUUA NA KUANGAMIZA KABISA WADUDU WA MAJUMBANI,OFISINI PAMOJA NA MASHAMBANI.. KAMPUNI HII IMESAJILIWA KWA MUJIBU WA SERIKALI CHINI YA BRELA. KAMPUNI HII NI MPYA KABISA NA INAW...,/img/tz/x/_1515415606-89-furmigation-and-pets.jpg
HARLOS COMP LIMITED,PO BOX 4412, Dar Es Salaam,We engage in container trading,conversion and repairing.Also we offer transport service.HARLOS is one of and intends to be one of the leading freight forwarding, relocation and project logistics manag...,/img/tz/f/_1477301426-61-harlos-comp-limited.jpg
JINAN WAYTEKO (T) LIMITED,NELSON MANDELA ROAD, TABATA - DAR ES SALLAM, Varsani Plaza, Dar Es Salaam,Our company over 5 years has been distributing spare parts for Chinese trucks, such as: Shacman, Howo, Faw, Dong Feng. Our offices and warehouses are located in Tanzania, China and Russia. We export a...,/img/tz/d/_1634132475-96-jinan-wayteko-t-limited.jpg
Livingstone Hotel,FORMULA 10 Livingstone Hotel Corner Livingstone and Amani Street, Kariakoo, Dar Es Salaam,Livingstone Hotel has all the modern facilities and amenities. We are in close proximity to shops, banks, restaurants, government offices and the local market. It is a great place to stay with profess...,/img/tz/j/_1463469670-31-livingstone-hotel.jpg
MOHAMED MEDICAL SUPPLIES LTD,P.O.BOX 42662 Mtukula Street, Chang'ombe Temeke DSM, Dar Es Salaam,MOHAMED MEDICAL SUPPLIES is a Business registered in 2011 under Brela’s Business Name Ordinance Cap 213 dealing with selling and servicing of Hospital, Laboratory Equipments and supply of Reagents. Th...,/img/tz/s/_1467571968-74-mohamed-medical-supplies-ltd.jpg
Nida Textile Mills,Plot No. 32, Nelson Mandela Road,Tabata, Dar Es Salaam,Nida Textile Mills (T) Limited is a vertically integrated textile composite established in 2000 engaging in processing cotton from its raw source to producing textile made-ups. It is part of the Giga ...,/img/tz/z/_1688842964-65-nida-textile-mills.jpg
Phoenix rubber rollers,p o box 65321,Dar Es Salaam, Tanzania, Dar Es Salaam,Rubber rollers Heidelberg printing machines like Gto, Kor, Kord, Kors, Mo, Speed Master 52, 72,74 and Sm102, Sork, Sord, Sors, Sorm etc Komori rubber rollers for inking and water form etc. sprint 26,2...,/img/tz/m/_1462270420-77-phoenix-rubber-rollers.jpg
Raguel Company Ltd,P.o.Box 34416, Dar Es Salaam,Raguel Company Ltd. Is a Tanzanian private Company, registered under the company’s act No 12 of the year 2002 to operate businesses across the Country. Growing from freelance consultancy service provi...,/img/tz/m/_1433335135-34-raguel-company-ltd.jpg
Reco Engineering Company Ltd,51, Chang'ombe Road, P.O.Box 873, Dar-es-Salaam, Tanzania., Dar Es Salaam,Reco Engineering Company Ltd is providing engineering services to various companies and workshops in Tanzania since 1948. Our aim to deliver the exceptional performance and service that our clients ex...,/img/tz/e/_1686117458_40111.png
Simba Digital Marketing Agency,Kimara Korogwe, Dar es Salaam, 16104, Dar Es Salaam,We are a family of digital marketers dedicated to helping businesses and personal brands grow online visibility to increase sales or brand awareness. Prospects and customers are already searching for ...,/img/tz/l/_1660328161-81-simba-digital-marketing-agency.jpg
Tanzanite Bliss/ EZ- Group,Oyster Pearl Galleria, 1st Floor, Plot 370, Chole Road - Oyster Bay, Dar Es Salaam,Tanzanite Bliss Ltd, agent company for EZ Group Building Equipment’s here in Tanzania! Please let us introduce our Company and the range of high-quality products we sell. EZ Group is a 40-year old Ita...,/img/tz/g/_1591872481-56-tanzanite-bliss-ez-group.jpg
The Rub | Beauty Salon and Day Spa,Alimaua Rd, Plot 2115 Kijitonyama P. O. Box 32329 Kijitonyama Dar es Salaam , Dar Es Salaam,The Rub is a beauty salon and day spa that’s primarily designed to provide customers with a good feeling in their body, mind and soul. Our services including waxing, tweezing and threading, unisex man...,/img/tz/x/_1453279801-71-the-rub-beauty-salon-and-day-spa.jpg
Tinovision Designs and Prints,Ubungo, Dar es salaam, Dar Es Salaam,Hi there, Welcome to the official page of the best creative agency found in Tanzania, we do BRANDING, SOCIAL MEDIA MANAGEMENT and GRAPHIC and MOTION GRAPHICS. We are experts to transform brands to the...,/img/tz/h/_1690409077-52-tinovision-designs-and-prints.jpg
Weighing Equipment & Supply Co. (WESCO),30 Mafia Street, Kariakoo, P.O Box 65298, Dar Es Salaam,COMPANY LOCATION AND ADDRESS: 30 Mafia Street, Kariakoo, P.O Box 65298 Dar es Salaam, TANZANIA Phone: + 255 (758) 000026 + 255 (754) 863564 E-Mail: [email protected] DIRECTOR: Mary Josephat Mushi +2...,/img/tz/k/_1460600973-18-weighing-equipment-supply-co-wesco.jpg
ARG SPARKLES LIMITED,Mwenge, Dar Es Salaam,ARG SPARKLES LTD is the distributor of fast-moving consumer goods especially mosquito repellent products like mosquito sticks, mosquito coils, as well as mosquito spray.,/img/tz/e/_1695289757-88-aogrand-tanzania.jpg
Armor Security Limited,11 Sido Street, Block 41, Dar Es Salaam,Armor Security Limited has a wealth of experience spanning over many years. We are capable of dealing with all your security needs and offer a complete range, planning system analysis and design as we...,/img/tz/a/_1670404309-65-armor-security-limited.jpg
Arwa Pharmacy,Ground Floor, Shop No. 2Benjamin William Mkapa Parking Towers, Jamhuri StreetDar Es Salaam 11104, Dar Es Salaam,We are a family-owned business, located in the heart of Ilala Central Business District (CBD), in Dar Es Salaam. It is different compared to other pharmaceutical franchises because of our unique abili...,/img/tz/s/_1619845662-71-arwa-pharmacy.jpg
Asar Limited since 1953,<span style="color: red">India</span> Street, Dar Es Salaam,Asar Ltd opened in 1953 and is an authorized dealer in Tanzania for some of the top brands in the world like Makita,Imer,Swepac and Rawlplug.We also have an authorized service center. At asar we belie...,/img/tz/s/_1657017937-23-asar-ltd.jpg
Auric Air Services Ltd,Viva Towers Office No 17 Floor No 2, Dar Es Salaam,"Auric Air Services Ltd" is Tanzania's preferred corporate and safari airline with a wide network of domestic scheduled services. From its bases at Mwanza Airport - Mwanza, Julius Nyerere Internationa...,/img/tz/j/_1433189878-41-auric-air-services-ltd.jpg
Buku Tano ~ Easy Hosting,P.O.Box 10532, Dar Es Salaam,Buku Tano is the #1 web hosting service provider and the best web hosting in Tanzania and Africa in general! We offer high-quality services and our prices are affordable. We do have Price Locked Forev...,/img/tz/m/_1633472965-53-buku-tano-easy-hosting.png
Car Junction Tanzania,EPZ ubungo industrial area, Dar-Es-Salaam, Dar Es Salaam,Car Junction Tanzania is among the leading Exporter of Japanese used vehicles, Spare Parts and tractors all over the world, especially in African regions like Tanzania. Car Junction has been always on...,/img/tz/n/_1669966368-94-car-junction-tanzania.jpg
Cosmos Group (T) Ltd,2205, Dar Es Salaam,Uhuru Town is yet another exciting project in D​​​​​​​​ar es Salaam, launched by Cosmos Builders Ltd (member of Cosmos Group Ltd), a renowned name in the construction industry in East Africa, the deve...,/img/tz/h/_1470728494-75-cosmos-group-t-ltd.png