Africa Best Conservated Destination Tours,Dar es salaam Hub Office, Nyerere Road, Dar Es Salaam,You must be thinking, why travel to Tanzania? Africa Best Conservated Destination Tours will provide the answer. Tanzania hosts three of the world`s natural wonders to behold by yourself, not only tha...,/img/tz/x/_1445975067-53-africa-best-conservated-destination-tours.jpg
AFRO GEMS,778, Dar Es Salaam,we are importers of fiber fishing boats from sri lanka, our main office is located at west Upanga, Mataka road, house no 5, plot number 778, and our yard is at Msasani beach near Pensinsula hospital. ...,/img/tz/m/_1664529813-83-afro-gems.jpg
AMAR TECHNOLOGIES LTD,Plot 15, office # 2, Mezzanine Floor, Africa Muslim AgencyUhuru street. Dar es salaam, Tanzania. , Dar Es Salaam,Information Communications and Technology company established in year 2004, dealing in wide range of ICT Solutions. Services ranging from PC Repairs to office Communication systems. Hardware biometric...,/img/tz/d/_1441286947-57-amar-technologies-ltd.png
Babysitters and House Maid in Dar es Salaam,KIjitonyama, Dar Es Salaam,We do offer house maid and babysitting (nanny) service in Dar es Salaam, Zanzibar and other cities. our offices are located in Dar es Salaam though we can reach you wherever you are in Tanzania,/img/tz/n/_1680267167-76-babysitters-and-house-maid-in-dar-es-salaam.jpg
Bayoumi And Chams Ltd(manics Dynamics),MANDELA ROAD -GARAGE BUS STAND, Dar Es Salaam,We would like to represent Bayoumi & Chams ltd (MANICS DYNAMICS), a leading supplier of crusher and mining spare parts. I am reaching out to explore potential business opportunities and establish a mu...,/img/tz/a/_1686908962-36-bayoumi-and-chams-ltd-manics-dynamics.jpg
Bongo Live,7th Floor, Ibrahim Manzil, Above Kearsly Travels, Zanaki St, Dar es Salaam, Dar Es Salaam,About Us Bongo Live! is a mobile services company based in Dar Es Salaam, Tanzania. We�re a team of individuals committed to bringing the next level of mobile and SMS based services to Tanzania. We b...,/img/tz/a/_1405497793_39147.png
Bridging Technologies Limited,Plot No 1437,Fish Market,Msasani, Dar Es Salaam,Bridging Technologies is fully a digital marketing agency vastly dealing with content creation and marketing,brand reputation and management,website analytics and consultancy,pay per click(ppc),Search...,/img/tz/r/_1615986637-88-bridging-technologies-limited.jpg
Burhani Infosys,Office 18, Annadil Burhani Complex, Magore St, Dar es Salaam, Dar Es Salaam,A complete IT Solutions company; Burhani Infosys, launched at the dawn of May 2009, provides ICT hardware, software, web, networking and customized solutions. Burhani Infosys focuses on providing pers...,/img/tz/e/_1617007541-41-burhani-infosys.jpg
Chino Asset Tracker,Magomeni Mikumi, P.O.Box 40256 Dar es salaam, Dar Es Salaam,Offering a new level of Assets control over your vehicles. Live GPS Tracking Device - Affordable Global Connectivity. it is the best GPS tracking system for Vehicle Management, Fuel Monitoring, Driver...,/img/tz/f/_1632582947-84-chino-asset-tracker.jpg
CLEANEX CLEANING & MAINTENANCE,Dar Free Market, Oysterbay, Dar Es Salaam,We specialize in Commercial Contract Cleaning and several other Facilities Services Specialties Commercial Cleaning, House Cleaning, Window Cleaning, Carpets Cleaning, Floor Cleaning, Gardening, Laund...,/img/tz/m/_1555437927-16-cleanex-cleaning-maintenance.jpg
Danbeth Solutions Limited,Mwanamboka Plaza, 2nd Floor, Kinondoni, Dar es salaam, Tanzania [email protected] , Dar Es Salaam,We are an IT Solutions and Services company, focusing on industry-specific niche solutions that help organizations in their journey of technological transformation.,/img/tz/b/_1651219939-58-danbeth-solutions.png
DENTOMEDICAL(T)RESOURCES,MBAGALA ROAD SUDAN BUS STOP, MPOLWE STR, PLOT# 52/1, BLOCK -C, P.O.BOX 12620, Dar Es Salaam,DENTOMEDICAL(T)RESOURCES Is a Partnership Business owned and operated by Tanzanians.The Company was established in March, 2019 with Business Registration Certificate No. 452039, Tax payer Identificati...,/img/tz/s/_1590577102-30-dentomedical-t-resources.jpg
Dreamchasers Technologies,P.O. Box 11584, Dar Es Salaam,Registered as Dreamchasers Solutions Limited we are the all-in-one ICT solutions that will foster the performance of your business. Our brands are D-TECH (IT solutions), D-STUDIOS (Graphic/Web Design)...,/img/tz/j/_1456136218-41-dreamchasers-technologies.jpg
DTS LOGISTICS COMPANY LIMITED,Nyerere road, Dar Es Salaam,Deals in the importation, sale, distribution and after-sales services for a wide range of products ranging from construction equipment, heavyweight equipment, concrete mixing equipment, light and heav...,/img/tz/j/_1671028753-37-dts-logistics-company-limited.jpg
Dudumizi Solutions,Dar es salaam, Dar Es Salaam,Dudumizi Solution (T) Ltd Offer a wide variety of services based on tech and digital world and this is due to market requirement. Those services is including: Website Design, Domain registration, Host...,/img/tz/j/_1414667841-dudumizi-solutions.png
Empty Container Depot,P.O.Box 11286, Dar Es Salaam,EMPTY CONTAINER DEPOT (ECD) Is license depot established by Euro COmmercials (EuroCom) Limited owned by Tanzania. EuroCom is the one stop logistics services provider that handle containerized goods To...,/img/tz/c/_1674409671-74-empty-container-depot.jpg
ETON INTERNATIONAL TANZANIA LIMITED,Plot No.: 49, Block 79, Makamba/ Sikukuu Street, P. O. Box 25314, Dar es Salaam, TANZANIA., Dar Es Salaam,ETON International (T) Ltd is full-service provider specialized in cooling systems for various products in a vast fields of Horticulture, Dairy product processing, Abattoir, Pharmaceutical, Beverage, ...,/img/tz/z/_1675144814-27-eton-international-tanzania-limited.jpg
Exmpor Engineering Tanzania Limited,Head Office No. B 307, 3rd Floor, Al Wadha Business Complex, Bibi Titi Mohamed Road, P. O. Box: 23305, Dar es Salaam. Branch Office: Kiembe Samaki, Opp. Keimbe Samaki Secondary School, Airport Road, P.O. Box: 2772, Zanzibar, Dar Es Salaam,Water Treatment, Waste Water Treatment, PET Bottling Lines, Glass Bottling Lines, Swimming Pools, Air Conditioning Systems, Industrial Laundry, Industrial Kitchen, Laboratory Services, AMC.,/img/tz/d/_1648562694-56-exmpor-engineering-tanzania-limited.jpg
Happy Kids Puzzles,Bamaga, Afrikasana , Dar es salaam, Dar Es Salaam,we are specialized in Creating and selling custom-made, High-Quality wooden puzzles for children of all ages. algebra puzzles, easy math puzzles, Numbers and Alphabets Puzzles, Shapes & Objects All it...,/img/tz/e/_1645082913-35-happy-kids-puzzles.jpg
HELMIC GROUP COMPANY LIMITED,P.O.BOX 60883,Dar Tanzania, Dar Es Salaam,We offer Transportation and Tourism services. Transportation includes, car rental, car wash, garage, car storage and public transport. Tourism includes, organizing tours, camping safaris, lodge safari...,/img/tz/f/_1441000481-49-helmic-group-company-limited.jpg
HouseTech Investment & General Supply LTD,Magomeni Mikumi, Dar Es Salaam,We provide a full scope of HVAC solutions and services from AC Maintenance, Repair, Service and Installation Service. We are Specialists in Air Conditioning Repair, Installation and Service. Professio...,/img/tz/e/_1619690340-47-housetech-investment-general-supply-ltd.jpg
ICTPACK SOLUTIONS LTD,Victoria Noble Center,15th Floor, New Bagamoyo Road, Dar Es Salaam,ICTPACK is a fastest growing Innovative ICT solutions provider with a focus on helping companies and organizations leverage emerging technologies to their competitive advantage. We use agile technique...,/img/tz/j/_1628772566-56-ictpack-solutions-ltd.png
IMIT,CATS TANZANIA LIMITED,P.O.BOX 2569 DAR ES SALAAM, Dar Es Salaam,The Institute of Management & Information Technology (IMIT) is the Training Institute based under CATS Tanzania Limited. Established in 1987, and formerly known as the ICL Training Center, its princip...,/img/tz/e/_1441447329-36-imit-cats-tanzania-limited.jpg
JV Biotech Enterprises Co Ltd,P.O.Box 35091, Dar Es Salaam,JV Biotech Enterprises Co Ltd is a versatile company in the food and agriculture sectors, offering agro-processing, agro-commodities trading, and agricultural consultancy services to a diverse range o...,/img/tz/n/_1679386599-76-jv-biotech-enterprises-co-ltd.jpg
Kulaya Group Cleaning Company,Makumbusho bus Stand, Dar Es Salaam,It's a cleaning company in Dar es Salaam that does all kind of cleaning, such as office cleaning, homes, we also do event planning. Give us a call now,/img/tz/g/_1691308927-31-kulaya-group-cleaning-company.jpg
Kulaya Language School,Makumbusho,Kijitonyama, Dar es Salaam , Dar Es Salaam,Kulaya Language School is based in Dar es Salaam Tanzania though it reaches students all over the world through its online language programs. KLS basically offers English Classes and Swahili Classes. ...,/img/tz/m/_1681895649-57-kulaya-language-school.jpg
Labspot Tanzania LTD,61361, Dar Es Salaam,We are direct importer of laboratory equipment, chemicals and apparatus, so we supply laboratory equipment, chemicals and apparatus at wholesale affordable prices to retailers medical laboratories, sc...,/img/tz/h/_1661923022-88-labspot-tanzania-ltd.jpg
Maperuk,Near Stanbic Bank Kindononi, Dar Es Salaam,We sell 100% Brazilian hair. High-quality hair extension at really cheap prices. 12 to 24 inches. Start your own hair business without stock. Order we deliver to your customers. Free delivery in Dar e...,/img/tz/c/_1404397414_45601.jpg
Markim company ltd,kinondoni, tunisia road, next to brake point opposite grave yard, Dar Es Salaam,WE SELL HIGH QUALITY GENERATORS KNOWN AS PERKINS AND ALSO DEAL WITH SWIMMING POOL EQUIPMENTS,CONSTRUCTIONS,CHEMICALS AND SERVICES (SWIMMING POOL AND GENERATORS).,/img/tz/a/_1645254612-20-markim-company-ltd.jpg
Massage For Women - Mobile,KIjitonyama, Dar es Salaam , Dar Es Salaam,Good Massage Therapies for Women, Acupressure Massage, Deep Tissue, Foot Massage, Full Body Massage, Happy Ending Massage, Head and Shoulder, Healing Touch, Hot Stone Massage, Integrative Acupressure,...,/img/tz/j/_1680873892-31-massage-for-women-mobile.jpg
Masaji Kwa wanawake Dar es Salaam,Sinza, Dar es Salaam , Dar Es Salaam,Good Massage Therapies for Women, Nuru Massage, erotic, yoni massage, Massage za sensual, massage aina nzuri sana ambazo zitakutoa ulipo.. massage za kisasa... Za nyonyo, za kila sehemu mwilini, za ma...,/img/tz/e/_1680875729-41-massage-kwa-wanawake-nyumani-hotelini.jpg
Mobile Massage in Dar es Salaam,Masaki, Dar Es Salaam,we do offer massage service around the city, at your hotel, apartment, or wherever you need a service, whenever you need it we are here for you. we do massage such as hot stone Masasge, deep tissue, Y...,/img/tz/e/_1680341718-70-mobile-massage-in-dar-es-salaam.jpg
5NET IT SOLUTION,77705, Dar Es Salaam,We Are Security Installer Service in Dar es Salaam at Great Prices. Call Us Today We Deals with Cctv Sys Fire Alarm Electric Fence in Dar es Salaam.Call Us for Information,/img/tz/l/_1660250192-84-5net-it-solution.jpg
NICE Tanzania,6th Floor Derm House- Kijitonyama, Daressalaam, P.O.Box 80712, Dar Es Salaam,NAMA Integrated Centre for Excellence Limited (NICE) is a social consulting firm focused on serving the comprehensive needs of corporate institutions, associations and civil society organizations in t...,/img/tz/m/_1630645615-82-nice-tanzania.jpg
Ocean Breeze Cleaning Company,03/27 Uhuru St., Dar es Salaam, Dar Es Salaam,We are a premier cleaning service provider in Tanzania, our main scope of business is commercial cleaning, building maintenance, janitorial services and more. We provide high-quality commercial cleani...,/img/tz/g/1384117021_30722.png
OfficeSpace,Plot 559, Old Bagamoyo Rd (Mwai Kibaki Rd), Kawe Beach, Dar Es Salaam,Based in Dar es Salaam, Tanzania, OfficeSpace is a dealer for "Teknion" furniture systems, "JEB International" demountable partitions and "Interface" modular carpet tiles. Our represented brands cater...,/img/tz/x/_1441810937-32-officespace.jpg
PRAMUKH STEEL INDUSTRIES,DAR-ES-SALLAM, Dar Es Salaam,About Us Found in 2007 by it’s young & visionary founders, Mr. Dinesh Panchal & Mr. Naimesh Panchal, PRMUKH STEEL INDUSTRIES is nowadays leading engineering company engaged in the Manufacturing of Bes...,/img/tz/e/_1473505300-64-pramukh-steel-industries.jpg
SantaPrint,Mawasiliano Bus Stand, Dar Es Salaam,We specializes in Creative Graphic Designing and Printing. Tunaprint vitu mbalimbal kama: - T-Shirts | Jezi | Mashati | Kofia | Lebo za Shule | Mifuko, n.k. - Mabango ukubwa wowote | Stickers | Roll-u...,/img/tz/c/_1649597162-73-santaprint.jpg
Suzana Mabula Fashion,Near Kigamboni Ferry Terminal, Kigamboni, Dar Es Salaam,Stylish clothes for all ages, traditional or casual or cultural style. Made by Fashion Designer Suzana Mabula in her sewing studio in Mbezi Beach, Dar es Salaam. Her own shop is located near the Kigam...,/img/tz/e/_1531652110-33-suzana-mabula-fashion.jpg
Tai Safaris Ltd,40062 Dar es Salaam,Ilala, Kiwalani, Dar Es Salaam,African Safari with Tai Safaris provides you with the ultimate Tanzanian holiday. Experience Tanzania’s rich diversity of wildlife, culture, history and activities. Whether you decide upon: a luxury l...,/img/tz/z/_1533475271-25-tai-safaris-ltd.jpg
Tanzania Water Equipment Supply Company,Plot no.104 AfrikaSana Road Opposite TRA Office Mwenge, Dar Es Salaam,Welcome to Tanzania Water Equipment Supply Company (TWESCO), the most effective and Reliable Water Treatment and Borehole Drillers, our Reverse Osmosis Systems, Seawater Desalination, Waste water mana...,/img/tz/s/_1459519772-63-tanzania-water-equipment-supply-company.jpg
Travel Hype Adventures,4275, Dar Es Salaam,We are tour agents with offices in Dar es Salaam and Arusha, offering safaris to all national parks,Northern, Southern and Western Tanzania, mount Kilimanjaro climbing, hiking at Usambara Mountains, L...,/img/tz/r/_1619175884-14-travel-hype-adventures.jpg
TruMark Company Limited,12382 Dar es salaam, Dar Es Salaam,Leading company in Event Management and Business Consultancy Services in Tanzania TruMark is a company with a strong focus on Supporting Business Development Services registered in the United Republic...,/img/tz/a/_1674151757-65-trumark-company-limited.jpg
Verge Holdings Ltd,Amani Place, P.O. Box 38568, Dar Es Salaam,VergeX exists for the love of luxury lifestyle, technology & fashion. We believe in empowering individuality and enhancing our customers lifestyles. Our mission is to be the East African digital platf...,/img/tz/e/_1627486151-85-verge-holdings-ltd.jpg
VG Media,Box10509 Dar Es Salaam, Tanzania., Dar Es Salaam,In nutshell We help business achieve their goal by provide quality and affordable marketing needs.,/img/tz/e/_1433461472-14-vg-media.jpg
Vitech Group Co. Ltd,P.O.BOX 60548, Dar Es Salaam,Vitech Group Co. Ltd Dealers on:. ICT SERVICES - Website designing and development - Web hosting - Domain name register - Systems and software development - Graphics design - Website content writing -...,/img/tz/g/_1458837535-82-vitech-group-co-ltd.png
Waxing Service in Dar es Salaam,Sinza, Dar es Salaam , Dar Es Salaam,Waxing services are all available here, bikini waxing, full body waxing, armpit waxing, Brazilian waxing. we also do outdoor services, therapist can come to your place for the good service.. give us a...,/img/tz/z/_1680934947-90-waxing-service-in-dar-es-salaam.jpg
Xfrey,Riverside, Ubungo, Dar Es Salaam,Xfrey aims at providing services with high Costumer Satisfaction ,quality and safety. Our company provides guarantee for its services. We are helping you to get happier and healthier life though our s...,/img/tz/g/_1554487754-13-xfrey.jpg
ZACK FINANCE,BUNJU B, DAR ES SALAAM Near UPENDO DISPENSARY, Dar Es Salaam,We are a financial institution which deals in micro credit activities(EMEGENCY LOANS), business consultation and debt collection activities since 2010.,/img/tz/j/_1454577973-62-zack-finance.gif
Africab,161/1, Kilwa Road, Kurasini Industrial Area, Near Puma Petrol Station, Temeke, Dar Es Salaam,We take great pleasure to introduce ourselves as manufacturer/supplier of various types of wires and cables. We started our manufacturing facility in 2002. Since then we have always attached highest d...,/img/tz/r/_1480145223-73-africab-tanznaia.jpg
Agrifi Export & Import,Airport Cargo, Swissport Building, Room No 13, DSM, Dar Es Salaam,THE LEADING SELLER AND DISTRIBUTOR OF QUALITY FISH AND FISHERIES PRODUCTS. Agrifi Export and Import Company Ltd is an is an Agribusiness Company registered in Tanzania with registration No.118354 of t...,/img/tz/d/_1649503391-36-agrifi-export-import.jpg
Bike Point,Fire Street, Dar Es Salaam,THE SERVICES WE OFFER: As a well established, we sell Genuine Spare parts of all Two wheeler bikes. As far as repairs are concerned we have a good service center where our staffs are well able and tra...,/img/tz/s/_1457170749-58-bike-point.jpg
BlinkView Tanzania,Plot No. 15, Bima Road, Mikocheni B, Dar Es Salaam,Blinkview is a creative content agency and IT solutions company based in Tanzania. we provide solutions for clients off all sizes in a wide range of industries. Blinkview aims to provide quality and s...,/img/tz/d/_1478230403-78-blinkview-tanzania.jpg
Business Registrations & Licensing Agency (BRELA),House, Plot No: 23, Block No: 20 Shaaban Robert Street, Sokoine Dr, Dar Es Salaam,For anyone focusing on fostering innovation, intellectual property protection is extremely critical. Leaving innovative ideas unprotected means that those behind them will not be able to reap the full...,/img/tz/e/_1688397671-46-business-registrations-licensing-agency-brela.jpg
Deep Image Studio,12 Faru Street, Dar es Salaam, Dar Es Salaam,We have a strong team of knowledgeable professionals from different disciplines, with decades of experience in Design, Printing, Branding & Production. We have accumulated unique know-how when it come...,/img/tz/x/_1644793492-37-deep-image-studio.png
DEMA DENTAL PRODUCT COMPANY,P O BOX 4044 DSM, Dar Es Salaam,For all your interior and exterior design needs we 've got the solution.,/img/tz/a/_1617220924-12-dema-dental-product-company.jpg
Dk Link Design Company,P. O. BOX 66980, Dar Es Salaam,Landscaping & Gardening, Fumigation, Cleaning Services* We are a group of individuals with different skill sets joined forces to deliver authentic, fast, reliable and assuring services at the most hig...,/img/tz/f/_1460536516-95-dk-link-design-company.jpg
Dolson Interiors,03 Chole Road, Masaki, Dar Es Salaam,At Dolson’s, we do one thing very well: We create simply fabulous soft furnishing solutions for homes and businesses. Since 2005, we have been specializing in providing a complete suite of wall and wi...,/img/tz/e/_1579697350-92-dolson-interiors.jpg
ELEGANCE FURNITURE LIMITED,Victoria Plaza, Samora Avenue / Morogoro road, Dar Es Salaam,Established in 2015, Elegance Furniture Ltd is a privately owned business. Elegance Furniture Ltd is a new company that will provide expertise and quality in the Office & Domestic Furniture market whi...,/img/tz/a/_1430594300-95-elegance-furniture-limited.jpg
EroLink - Recruitment Specialist,Head Office & Training Centre 1720 Haile Selassie Road, Masaki, Dar Es Salaam,EROLINK Limited (“Erolink”) is your Education, Recruitment, and Outsourcing Link in Tanzania. We offer professional and effective services to our clients and employees, and take pride in sourcing and ...,/img/tz/d/_1549013790-25-erolink-recruitment-specialist.jpg
Kaymu Tanzania,P.o. Box 2929 , Dar Es Salaam,Kaymu is the #1 online shopping community in Tanzania. We connect buyers and sellers, but do not have any inventory of our own. Our founders believe that the internet can break economic barriers and c...,/img/tz/s/_1549021976-71-kaymu-tanzania.png
KIWALEIS INVESTMENT CO LTD,1, Dar Es Salaam,Transporters {Local & International } and supplies of all kinds of building materials. Managing Director Isaya kiwale Head office Plot no 620 block A Buguruni area Ilala Dar es salaam,/img/tz/x/_1572932346-53-kiwaleis-investment-co-ltd.jpg
Makazi Lodges Ltd,P.O Box 32021, Dar Es Salaam,A cosy bed and breakfast located in Mwananyamala Koma Koma, Kinondoni, Dar es Salaam, Tanzania. Ideal for those traveling to Dar es Salaam for leisure, vacations, business or conferences. It has a pea...,/img/tz/g/_1506510909-92-makazi-lodges-ltd.png
Ndola Engineering Works Ltd,P O Box 13806 Dar Es Salaam, Dar Es Salaam,Mbezi Beach opposite Interchick and along side IMTU College Another branch is at Tegeta Plot 6 P.O. Box 13806 Dar Es Salaam, Tanzania We deal with a variety of Construction equipment, concrete product...,/img/tz/e/_1617267073-11-ndola-engineering-works-ltd.jpg
Ukumbitz,Kinondoni, Dar Es Salaam,About"Tafuta Ukumbi bila jasho Je unahitaji ukumbi wa sherehe, harusi, send off, mikutano, vikao, kongamano au mahafali na shughuli zingine nyingi? Okoa muda, fanya booking ya ukumbi kidigitali. pata ...,/img/tz/a/_1674296390-20-oceanware-ltd.jpg
P&D TWINS DISTRIBUTORS LTD,p o box 65311,dar es salaam tanzania, Dar Es Salaam,P&D Twins distributors ltd was established in 2012. We specialist in flyer distribution, newspaper distribution and sample distribution. Houses, PO Boxes, Intersections and Office Parks within greater...,/img/tz/e/_1355458300_39113.png
sea rock investments company,P.o Box 40845, Dar es salaam, Dar Es Salaam,We are registered company dealing with construction works in buildings, civil works, irrigation schemes , real estates & land development. For the time being we have surveyed approved plots for differ...,/img/tz/j/_1457086361-45-sea-rock-investments-company.jpg
Selous explorer,P.o. Box 22694, Libya/Band street Kisutu, Dar es salaam,Tanzania, Dar Es Salaam,About Selous Explorer Selous Exporer comes out from many years’ experience of a group of Tanzanian professionals in the field of tourism. Passion for our job and commitment to the clients are the reas...,/img/tz/e/_1603428988-91-selous-explorer.jpg
Sparta Gym,Somali / Lumumba St, Dar Es Salaam,One of the best Fitness Gyms in Kariakoo Area offering various fitness activities.Just off Lumumba Street adjacent to New Ushirika Towers CRDB on the 6th Floor opposite to Sumry Bus Try us today. Heal...,/img/tz/h/_1421051872-sparta-gym.jpg
Streamline Consulting Limited,LEVEL 4, PLOT NO.638, Samora Avenue, Dar Es Salaam,We are close-knit organized team that consists of Professional Lawyers,Professional Fraud Investigators,and Professional Risk Managers,dynamic and talented achievers.Among us are professionals in Comp...,/img/tz/f/_1481810393-34-streamline-consulting-limited.jpg
Tanzania Fixer,Chimara Street, Palm residency, Ilala, Dar es Salaam, Dar Es Salaam,TANZANIA FIXER is a full line production service for feature, commercials, corporate, documentary film shooting. Professional assistance to shoot in Tanzania. More than a traditional film fixer, TANZA...,/img/tz/e/_1622910323-13-tanzania-fixer.jpg
Toyota Hilux Tanzania,Airpot road, Dar es Salaam Tanzania, Dar Es Salaam,Toyotahilux.co.tz Offers Brand New Toyota Hilux for Sale in Tanzania. We offer Toyota Hilux Single Cab, Smart Cab & Double Cab Pickups at market-competitive prices in Tanzania. We at Toyota Hilux Tanz...,/img/tz/x/_1678270752-36-toyota-hilux-tanzania.png
WANSLU & E-GOUWU TANZANIA,Bahari Beach , Dar Es Salaam,Shaoxing Longchen company at unbeatable prices (B2B) We are an international trade company, located in Shaoxing, China, serving businessmen that want to import all kinds of goods from China. We have c...,/img/tz/e/_1648186224-41-wanslu-e-gouwu-tanzania.jpg
Africa Batteries Ltd,Plot No. 11/47 , Zanaki Street , P.O. Box 21800 ., Dar Es Salaam,Wholesalers and Retailers for Motor Vehicle Batteries , Tyres , Lubricants and Accessories.,/img/tz/h/_1414667775-africa-batteries-ltd.jpg
Afrotalia International Limited,Mikocheni B - Mwai Kibaki Road - Business Bus Stand - Building No. 161 - Dar es salaam, Dar Es Salaam,Our vision, mission and goals are your safety and satisfaction. Therefore, we choose our products due to the international standards. In particular European standards. Above all quality and safety. As...,/img/tz/h/_1618360733-11-afrotalia-international-limited.jpg
Baridi Baridi Tanzania Limited,33758, Dar Es Salaam,Baridi Baridi provide the best AC solutions with DAIKIN INVERTER AC (Air Conditioner) through subscription & instalment service. Choose Baridi service & be free from AC trouble. Check our website to k...,/img/tz/j/_1668693538-76-baridi-baridi-tanzania-limited.jpg
Bencus Marketing Solutions,Chang'ombe, P.O Box 104420, Dar Es Salaam, Dar Es Salaam,Bencus Marketing Solutions is a digital marketing solutions provider based in Dar Es Salaam, Tanzania. Bencus Marketing Solutions offers services categorized in three major categories, marketing servi...,/img/tz/d/1393235050_41089.jpg
Best Western Coral Beach Hotel,Plot 956/1412, Coral Lane, Masaki, Msasani Peninsula, Dar Es Salaam,Welcome to our Dar es Salaam beach hotel where you can enjoy breathtaking views of the Indian ocean in a tranquil setting. Whether you're traveling to East Africa for business, as an NGO volunteer, or...,/img/tz/b/_1463661136-50-best-western-coral-beach-hotel.jpg
Bright Cooling & Services Centre(BCSC),Kiwalani, Airport Road, Dar Es Salaam,Bright Cooling & Services Centre is a private company specializes in AC sales, services, designing, installation, commissioning, repairs and maintenance.All types of air conditioners and other cooling...,/img/tz/k/_1561632748-15-bright-cooling-services-centre-bcsc.jpg
CATS-NET LIMITED,16th Floor RITA Tower Makanganya/Simu Street, Dar Es Salaam,We are pioneers of Information and Communication Technology in Tanzania, providing turnkey solutions with high-speed Internet, Data and VoIP Connectivity on various platforms including Fiber, VSAT and...,/img/tz/e/_1487764237-80-cats-net-limited.jpg
